product_name,reviewer,review_date,review_text
Mainstays 14 High Profile Foldable Steel Twin XL Platform Bed Frame White,Savannah,10/31/2021,"So me and my boyfriend broke our last bed, it just wasn't sturdy. BUT THIS ONE IS STURDY! I got the 14 inch high regular and it is awesome. It is a lot higher than you'd expect and the material is heavy!! Very easy to put together, thank God we don't have to sleep on the floor anymore"
Mainstays 14 High Profile Foldable Steel Twin XL Platform Bed Frame White,Cmalloy,8/10/2021,Was exactly what I needed for my 10 year olds bed it was easy to assemble and fit right in between her bed frame. Only complaint the box was damaged upon arrival and 1 of the metal pieces was broken on the frame but I was ok with that it still serves its purpose
Mainstays 14 High Profile Foldable Steel Twin XL Platform Bed Frame White,Felicia,8/26/2021,"As I was setting one up I notice broken wires/bars on the bed frame.  It was already two days late from the supposed delivery.  So when it came broken I was disappointed because overall it seemed a pretty good, sturdy quality.  I set the second one up and it was fine.  I decided to keep and not return because it was already a hassle to get it here, then down to my room, then assemble it.  I'll just get some gorilla glue to connect the broken pieces."
Mainstays 14 High Profile Foldable Steel Twin XL Platform Bed Frame White,pgll,12/1/2021,"We moved into a temp apt while renovating and these bed frames were a great option
Sturdy, compact (it folds), comfortable
We bought inexpensive mattresses , used this frame and we got a very comfortable bed!"
Mainstays 14 High Profile Foldable Steel Twin XL Platform Bed Frame White,Twiggy,7/11/2020,"Highly recommend,  My son said this one was better than his. I bought a bed for my sister to visit,  We put this up quickly its sturdy Excellent! love it Perfect height for pillow top memory foam mattress no need for a box spring. I'm impressed"
Mainstays 14 High Profile Foldable Steel Twin XL Platform Bed Frame White,silverseahorse,2/16/2017,Saw this online for $30 at where else but Walmart and I jumped on it! Set up was easy and quick. Basically a folded frame. Open it up and snaps into place. Wa LA!
Mainstays 14 High Profile Foldable Steel Twin XL Platform Bed Frame White,LittleFreedom,8/30/2020,"You get what you pay for. 
On that note, it's fine 
Two wires were missing and not in the box. I think it will be fine. I put a large board for extra support.
Easy set up."
Mainstays 14 High Profile Foldable Steel Twin XL Platform Bed Frame White,Misty,7/23/2020,"Wow!  Great product. Super easy to assemble.  Very sturdy and well made. For the record, don't try to use a boxsprings, you will need a 6ft ladder to get on the bed (lol). See pic :-)"
Mainstays 14 High Profile Foldable Steel Twin XL Platform Bed Frame White,FLOMO,7/18/2021,"I purchased this bed frame from Walmart.com about 3 1/2 months ago, along with the Slumber 1 by Zinus-Pressure Relief Hybrid Mattress, 10"", Full for my 19 yr old daughter who was switching from a twin to a full size mattress.  My husband and my daughter set up the frame together, took maybe 10 mins or less.  The new mattress fit perfectly.   My daughter hasn't had any issues with it so it is holding up pretty great.  The best part is that its 14 inches high.  I bought 2 large under the bed storage boxes that fit perfectly underneath.  My son will need a new mattress soon so I may possibly purchase the same mattress and this same bed frame in the near future."
Mainstays 14 High Profile Foldable Steel Twin XL Platform Bed Frame White,Sarah,4/15/2021,"Love it. Very sturdy, easy to move... dont need a box spring. So far its been great. This would have been perfect for my college years moving so much, and having weird hall ways and stairwells to fit beds and box springs thru. I wanted the 18in but it sold out. The 14 is perfect tho. Now Ill have extra space to store bins under my bed.. the frame also has holes around it invade you want to attach head/foot boards."
Mainstays 14 High Profile Foldable Steel Twin XL Platform Bed Frame White,jackal,5/30/2021,"I bought four of these they are very sturdy. easy to open and since it folds its great to move around. I was able to fit it up the attic in an opening on 42"" easily. the bed frame is 39"" when folded. Perfect height (14"") to put things under also. Delivery was quick I recommend this frame. I bought these for the grandkids, and I am 5.4 and 180lbs and it held me fine. perfect for camping not too heavy to carry."
Mainstays 14 High Profile Foldable Steel Twin XL Platform Bed Frame White,Alice,5/16/2021,"This bed frame is just what I was looking for. I bought a full size foldable mattress from Amazon several months ago and was looking for a foldable frame for it. I shopped Ikea and Amazon, before purchasing this one. The price was great! Its much cheaper than both Ikea and Amazon. It arrived right on time when no damage or other issues. The set up was sooo easy. It took me all of 10 minutes. It was also very easy to break down! The quality was surprising. I slept on it the first night to test it out. I didnt feel the bars through my 6 inch memory foam mattress. It didnt rattle or squeak when I moved. I didnt attach the two frames together but it didnt move. I slept very comfortably! It stores perfectly in our attic access space.plan to take..."
Mainstays 14 High Profile Foldable Steel Twin XL Platform Bed Frame White,Lawrence,6/22/2021,"Needed a platform for a short term use inside of a cargo trailer during a major event.  Ordered this thing and was pleasantly surprised.  Best of all, it folds down to 3 1/2"" thick in a box 40"" x 40"".  Rather than using a cot or foam on the floor, I'll use this platform with an existing twin bed for much more comfy sleeping."
Mainstays 14 High Profile Foldable Steel Twin XL Platform Bed Frame White,Yassine,3/13/2022,Legs dosent much one is taller than the other one
Mainstays 14 High Profile Foldable Steel Twin XL Platform Bed Frame White,Marilyn,3/1/2022,Easy to set up.   Works perfect in guest bedroom.  Has room under for storage
Mainstays 14 High Profile Foldable Steel Twin XL Platform Bed Frame White,jennifer,11/20/2020,Ive purchased many of these frames over the last few years and this king frame I upgraded my king bed to...is awfullllll! Theres about 4 or 5 inches of extra frame that sticks out! I just got a brand new king mattress for the!!!!!my Guy has hit his leg on that metal too many times in the few weeks weve had it! Thats a big problem and now we have to buy another frame! Wasted money sucks!
Mainstays 14 High Profile Foldable Steel Twin XL Platform Bed Frame White,c,3/31/2021,"My old box spring was shot, and was looking for a temporary fix.  Well this might be permanent. I sleep on a 12 inch thick coolgel memory foam matress, and have noticed a world of difference just in one night's sleep. I can't feel the bars or any part of the frame when laying down. 10/10. No more sleeping in the bottom of a u shape."
Mainstays 14 High Profile Foldable Steel Twin XL Platform Bed Frame White,JGMG,12/8/2016,This frame is strong and so easy to put up!!! My granddaughter loves it for sleep overs.  And a Privacy Pop bed tent makes it super cozy!!
Mainstays 14 High Profile Foldable Steel Twin XL Platform Bed Frame White,Joseline,10/11/2021,"It was so easy to put together as I got a Queen, total 2 pcs and I'm extremely satisfied, good material, sturdy, and no squeaking noise!"
Mainstays 14 High Profile Foldable Steel Twin XL Platform Bed Frame White,Elizabeth,5/18/2021,"This is very practical and light weighted, anyone can easily install and great if you need to move, it really does not take up any space in case you were to place away."
Mainstays 14 High Profile Foldable Steel Twin XL Platform Bed Frame White,LILLY,4/26/2021,Quality item at a good price as expected from Wally World. Took it out of the box and simply unfolded it and put my mattress on and tada! Cat is obsessed with his new bed. There's also a good amount of space underneath bed for storage.
Mainstays 14 High Profile Foldable Steel Twin XL Platform Bed Frame White,Emily,7/20/2021,"I loved how easy it was to put together. Finally sleeping on a bed frame that doesn't require a box spring. So comfy with my 10"" memory foam mattress."
Mainstays 14 High Profile Foldable Steel Twin XL Platform Bed Frame White,Maureen,12/21/2021,very easy to set up very durable and strong I recommend it to anybody I give it five stars!
Mainstays 14 High Profile Foldable Steel Twin XL Platform Bed Frame White,DeeDee,7/21/2020,I just received this frame and it is very sturdy!! It only took a few minutes to open it and screw in the two screws that attach the two frames. I love the space it provides for storage. This was a great buy.
Mainstays 14 High Profile Foldable Steel Twin XL Platform Bed Frame White,D,8/25/2020,"Easy to set up, very sturdy, and I love how high it is. Good for storing things under the bed and I didn't need a box spring for my mattress. I bought two for both beds in my house."
Mainstays 14 High Profile Foldable Steel Twin XL Platform Bed Frame White,ProudMomofaNursenTeacher,8/1/2020,I have a small bedroom I wanted to redo. I got rid of a big bulky twin size sleigh bed and wanted something smaller and a headboard to match a dresser. I bought the 18 inch high twin frame and used my mattress on it. I made a headboard to match a dresser and am extremely happy with the bed frame. It's a plus to have storage room underneath. I used a bed skirt to hide my storage area. The frame is sturdy and very easy to set up. I am a happy customer. I'm now planning to redo another room and will be coming back for another frame in a full size.
Mainstays 14 High Profile Foldable Steel Twin XL Platform Bed Frame White,Kelly,4/7/2020,"It's perfect! No squeaking, it's sturdy and I can store large totes under it"
Mainstays 14 High Profile Foldable Steel Twin XL Platform Bed Frame White,Dran,6/9/2020,Easy to use and high enough for storage space
Mainstays 14 High Profile Foldable Steel Twin XL Platform Bed Frame White,Bortan,10/30/2016,I love this bed frame. Just open from the box two clicks and it ready to use.
Mainstays 14 High Profile Foldable Steel Twin XL Platform Bed Frame White,Pp,8/11/2021,easy to setup .   took under 10 mins
Mainstays 14 High Profile Foldable Steel Twin XL Platform Bed Frame White,muhammad,8/9/2021,"Received the item damaged, rusted and broken and want replacement"
Mainstays 14 High Profile Foldable Steel Twin XL Platform Bed Frame White,Olivia,8/1/2021,Sturdy and nice elevation.
Mainstays 14 High Profile Foldable Steel Twin XL Platform Bed Frame White,Taylor,11/19/2021,Awesome bed frame for the price! Super easy to assemble as well!
Mainstays 14 High Profile Foldable Steel Twin XL Platform Bed Frame White,ebonie,7/6/2021,"very strong/ sterdy love how high it sits 
not heavy when there is not a mattress on it 
also good for storage"
Mainstays 14 High Profile Foldable Steel Twin XL Platform Bed Frame White,April,5/14/2021,"I didn't know that it would have the bed sitting up that high. I would of got the 14 inch but it was sold out. Overall my daughter likes it,"
Mainstays 14 High Profile Foldable Steel Twin XL Platform Bed Frame White,Leonmario,6/9/2021,Easy to set up. Sturdy enough. Fits mattress perfectly. Right height. Great price. I am very happy with this purchase. Should have made it a long ago
Mainstays 14 High Profile Foldable Steel Twin XL Platform Bed Frame White,BrensWorld,5/25/2021,"I love the white color, and it is high enough off of the carpet that I can store a multitude of things."
Mainstays 14 High Profile Foldable Steel Twin XL Platform Bed Frame White,Susan,10/22/2020,"Lightweight, but strong frame supports mattress securely.  Easy to set up, no tools needed. Love that it folds up for storage. The platform style bed is new to me, but I'm so glad I went with it. The frame design allows for ample under the bed storage for all my shoes. An unexpected benefit is that not having a head or foot board makes it so much easier to make the bed.  I am very satisfied."
Mainstays 14 High Profile Foldable Steel Twin XL Platform Bed Frame White,Victoria,1/6/2021,"Ordered this not expecting very much for the price, however it actually seems quite sturdy. Only arrived a day late. I ordered this in black and so apparent chips or scuffs. Extremely easy to set up. All you have to do is unfold it and pull out the outer two legs click them into place and it's ready. I was worried about how much weight it could hold but it holds me, a child, and two dogs just fine. Roughly 350lbs. It sets a little higher than I thought it would but that is no issue. All in all if the need arose I would definitely order another one. It also folds back up decently small for easy storage."
Mainstays 14 High Profile Foldable Steel Twin XL Platform Bed Frame White,PurpleJellyFish,10/29/2020,I would have given this a higher rating but the item arrived with some bent bars and one scrape mark on the powder coat with a small dent in one of the legs.  Otherwise is is easy to assemble and a nice frame.  Just wish it was not bent and scratched.
Mainstays 14 High Profile Foldable Steel Twin XL Platform Bed Frame White,PleasantlySurprised,3/23/2021,"Sturdy bed frame, makes single mattress much more comfortable than the box spring did. But it is SO TALL! I didn't totally realize how tall it would be once we put the 13' mattress on it. Definitely not for short people or little kids. Plenty of room for storage, but I wish that the ends didn't have bars that prevent you from shoving totes under it that way. We have it against a wall on one side and we have a twin bed on a 15"" frame next to it on the other side (it makes for a great multi level seating area) but because of the cross bars, we can't slide anything under the bed through the ends. Not a huge deal though. Very sturdy and worth the money. The picture attached shows a twin IKEA mattress on a 15"" frame with the monster behind it."
Mainstays 14 High Profile Foldable Steel Twin XL Platform Bed Frame White,KenHope,10/5/2020,"This is an excellent bed frame, it literally takes no tools to set it up, it comes as two bed frames they bolt together with wing nut bolts, sturd y and literally sets up in 5 minutes, I highly recommend this bed frame if this is what you're looking for..."
Mainstays 14 High Profile Foldable Steel Twin XL Platform Bed Frame White,resunset13601,11/8/2020,"I got the frame in White and the size was Queen 14"".   The box in which it came had a couple dents in it and one spot was ripped open a little.    When unboxed,  as I was putting the frame together,  I noticed one of the wires was a little  bent. (see picture)   I think that happen in shipping because the box did come a little damaged but since it was only one wire I wasn't going to take the frame back to the store so I bent it back in place and  positioned the frame so the one wire  that was bent I straightened  is at the foot end of the bedframe  where there is less movement when laying in bed.  I really don't think it will become an issue.   Took me less than 15 minutes to have it all together with mattress on it.  So easy to assemble.  ..."
Mainstays 14 High Profile Foldable Steel Twin XL Platform Bed Frame White,AshleyS,1/18/2021,"I bought this twin bed frame to use for my son's mattress, I didn't want to purchase a box spring so I knew that this was the route I would need to take. So far it's worked out wonderfully a straight out of the box all I had to do was unfold it and then unfold the legs. the only complaint that I can think of is that it does not lock in place so if you pull up on it from the center it's going to begin folding which is only an issue when trying to move the bed around."
Mainstays 14 High Profile Foldable Steel Twin XL Platform Bed Frame White,melissa,10/12/2020,"We bought this platform in lieu of a foundation for our new mattress. Like many folks,, we assumed our old mattress was why we were waking up sore. Because it would be another week before the mattress arrived, and my being impatient, I went ahead and assembled the platform and put my old mattress on it til the new one arrived. As it turned out, it was our old foundation. I slept great on my old mattresses! This frame honestly provided more support than I thought it would. It also doesn't allow the mattress to shift and I can double stack my underwear storage totes. My husband and I are very happy with this purchase and have already recommended this frame to our friends and family!"
Mainstays 14 High Profile Foldable Steel Twin XL Platform Bed Frame White,Babydol123455,5/2/2021,Works perfect for my guest room.
Mainstays 14 High Profile Foldable Steel Twin XL Platform Bed Frame White,Daniela,5/11/2021,It came with this but is easy to assemble
Mainstays 14 High Profile Foldable Steel Twin XL Platform Bed Frame White,IjeO,7/17/2021,Perfect height. Easy to assemble. Very simple and minimal-looking.
Mainstays 14 High Profile Foldable Steel Twin XL Platform Bed Frame White,Ada87,4/7/2021,Took me about 15 minutes to set up. Enough space under frame.
Mainstays 14 High Profile Foldable Steel Twin XL Platform Bed Frame White,Rebecca,5/11/2021,perfect better than expected
Mainstays 14 High Profile Foldable Steel Twin XL Platform Bed Frame White,Shaoping,4/16/2021,"Only used for a month, the frame is broken!"
Mainstays 14 High Profile Foldable Steel Twin XL Platform Bed Frame White,Chain,6/19/2021,"Simple and easy to put up, seems quite sturdy and quite abit of space for storage underneath."
Mainstays 14 High Profile Foldable Steel Twin XL Platform Bed Frame White,Maritza,4/10/2021,Great item but came in damaged not too big of a deal. One of the rails came a little bent.
Mainstays 14 High Profile Foldable Steel Twin XL Platform Bed Frame White,carmin,8/10/2021,good for price.
Mainstays 14 High Profile Foldable Steel Twin XL Platform Bed Frame White,Trudy,7/10/2020,"Nice, perfect for me."
Mainstays 14 High Profile Foldable Steel Twin XL Platform Bed Frame White,Andrea,3/23/2021,WOW! Just take it out of the box and unfold. Durable and sturdy enough for 2 kids to jump on.  No tools it just pop the legs out and place where you need. Not heavy tall enough to store things underneath.
Mainstays 14 High Profile Foldable Steel Twin XL Platform Bed Frame White,Lorrie,3/10/2022,We love our new bed frame. We decided to remove the boxsprings and just lay the mattress flat on the frame. It works perfect. I wished we would have purchased this a long time ago.  We love the additional storage underneath.
Mainstays 14 High Profile Foldable Steel Twin XL Platform Bed Frame White,DurgasaiprasadYelluri,11/24/2020,"Not a bad product but 
delivered used one. See the pictures. This is not fair to send used one for new price. Also delay in deliver than original promised. Package quality is very poor
I'm going to return it soon"
Mainstays 14 High Profile Foldable Steel Twin XL Platform Bed Frame White,Sephra,3/15/2021,"It was easy to set up and I love the concept but ours came dented, rusty, and had many black marks all over it. It looks like it has either been sitting in the warehouse way too long or it was previously used..."
Mainstays 14 High Profile Foldable Steel Twin XL Platform Bed Frame White,Marcy,2/19/2021,So easy to put together less than 2 minutes. I love all that space underneath the bed. Iv used it for storage. It's so high up you don't need a box spring. So far no complains!
Mainstays 14 High Profile Foldable Steel Twin XL Platform Bed Frame White,Angela,3/28/2021,Just get longer screws for the middle of the bed to hold the middle together so it won't look warped.  The photo that I put in is before middle screws were replaced.
Mainstays 14 High Profile Foldable Steel Twin XL Platform Bed Frame White,Naomi,12/22/2021,"Very sturdy 18"" tall bed frame.  It is a lot taller than I pictured with my 10"" thick mattress, but the storage room underneath is great. It was easy to set up too. I also bought headboard brackets and easily attached a headboard. Except the bolt hole for the bracket is right next to one of the support arms, so it was a little awkward to work in, but now that all is bolted together, it's very strong and sturdy. No noise or anything."
Mainstays 14 High Profile Foldable Steel Twin XL Platform Bed Frame White,Kathleen,4/13/2021,Love it
Mainstays 14 High Profile Foldable Steel Twin XL Platform Bed Frame White,Tonya,4/3/2021,The best so far.
Mainstays 14 High Profile Foldable Steel Twin XL Platform Bed Frame White,Zykia,2/25/2022,it came premade which made for an easy assmble but im just very unsure about this product! it was two twin bedframes and you just connect them. To me a bedframe like this won't lastong so use for quick purposes only this is not something you'll have for years to come maybe a good two months then I'll probably have to go to a furniture store and get another bedframe
Mainstays 14 High Profile Foldable Steel Twin XL Platform Bed Frame White,Pamala,1/27/2022,I am very happy with this queen size platform bed frame. I have been searching for something that was going to be sturdy even though it's going into a guest room. I am pleased with the storage  I can put underneath.
Mainstays 14 High Profile Foldable Steel Twin XL Platform Bed Frame White,direthia,2/9/2022,Not what I expected. Nice bedframe but  there were no wheels on it for easy setup and removal.Did not come with a mattress or pad.Does not fold in a way that a mattress can be stored within the frame.
Mainstays 14 High Profile Foldable Steel Twin XL Platform Bed Frame White,takeisha,5/13/2020,Love it!!! I bought this in king size. about 6 years ago and it's still in awesome shape very sturdy no dents or structural damage overtime and me and husband just recently moved into new home and upgraded our mattress. And we kept the bed frame and just added a new headboard.
Mainstays 14 High Profile Foldable Steel Twin XL Platform Bed Frame White,Amber,5/20/2020,"The price, you cant beat it. If youre looking for something cheap and worth every penny, just buy this. It does its job and is very sturdy! 

I just moved into my house so my bed and box springs were on the floor until this arrived. You do NOT need a box spring for this frame, but I already had one so Im still using it. When I tell yall this frame is SUPER talllllllll with my box spring and pillowtop mattress!! Its freakishly tall Ã°ÂŸÂ˜Â‚Ã°ÂŸÂ˜Â‚Ã°ÂŸÂ˜Â‚Ã°ÂŸÂ˜Â‚ my son and I were cracking upppp after we threw the mattress on, he could barely get up here. So I wouldnt recommend using a box spring if youre short unless you have a stool to step on to enter your bed Ã°ÂŸÂ˜Â‚ but other than that this frame is great! Sturdy. Doesnt squeek. Overall GREAT buy! You ca..."
Mainstays 14 High Profile Foldable Steel Twin XL Platform Bed Frame White,,5/7/2020,"Our frame was delivered within three days. I bought the queen sized, so it came with two pieces. The box is quite large, but easy to move. My husband pulled them out and set them up with ease. I did notice that one of the frames had a bend in the middle of it. However, once the matress is on top you can't feel it. Hopefully, it won't cause any issues later on. They were very easy to put together. The height of the frame is perfect, it isn't too tall or too short (I'm 5'2""). The space underneath can come in handy as well. If you're looking for a frame that is sturdy, reasonably priced, and easy to use, this is the one for you! It holds myself, my husband, our kids, and even our big dog (husky/shepherd mix).  Even though it had a dent in it, ..."
Mainstays 14 High Profile Foldable Steel Twin XL Platform Bed Frame White,CARISSA,4/8/2020,I usually don't write reviews but this frame is awesome! Very very sturdy even with a memory foam mattress. So easy to put together (less than 5 minutes) and so much space underneath for storage. So glad I made this choice and you won't be disappointed!
Mainstays 14 High Profile Foldable Steel Twin XL Platform Bed Frame White,Eden,7/21/2019,"Originally i bought the 14"" Zinus from Amazon bc Walmart didn't show for platform bed frame when i searched.  I got the Zinus 14"" and it was great but this one is fantastic! Its the little details that make a huge difference!!!  I returned the other one bc i needed 2"" more space but if you look at the 2 brands the zinus has the supporting braces folding inward at a 45Â° angle taking up the storage space.  The mainstay one has the braces folding outward at maybe a 22.5Â° angle which gives you more space. The extra 4"" in height,  more vertical space under bc the support bracebut plus it was way easier to put together and let's not forget that it was much cheaper! I'm so HAPPY with this buy. If you feel stressed bc you need more space and the cl..."
Mainstays 14 High Profile Foldable Steel Twin XL Platform Bed Frame White,JoeswifeErin,7/3/2020,I bought this bed frame about a week ago. It was delivered very fast and was so simple to set up! I waited until we slept on it for at least a week before giving my review. I LOVE this bedframe! we bought it in hopes of helping make our bed more comfortable because the basic metal bedframe with box spring was making both my husband and I wake up with our backs hurting bad. It was so bad that we weren't sleeping thru the night anymore. So I started researching bedframes and if getting rid of the box spring and using a platform frame would help and decided to try it. It really worked and we have been sleeping great for a week now! I can't believe how much of a difference there is! If you are looking into changing your bedframe and need someth...
